{
  "schema": "chatgpt_lab.controller_state.v1",
  "repository": "grahama1970/chatgpt-lab",
  "branch": "main",
  "phase": "awaiting-next-webgpt-task",
  "state": "READY_FOR_NEXT_TASK",
  "current_iteration": {
    "iteration_id": "2026-06-26-webgpt-mvp-loop-caption-002",
    "release_receipt": "iterations/2026-06-26-webgpt-mvp-loop-caption-002/release-receipt.json",
    "request": "iterations/2026-06-26-webgpt-mvp-loop-caption-002/request.md"
  },
  "latest_release": {
    "status": "DEPLOYED",
    "pr": 10,
    "merged_pr": {
      "number": 10,
      "url": "https://github.com/grahama1970/chatgpt-lab/pull/10",
      "state": "MERGED",
      "merged_at": "2026-06-26T21:15:17Z",
      "reviewed_head_sha": "1bdc732c671ceedeed728e01c498b50ed24ccd78",
      "merge_commit": "d4c013ce98fd78ef4efcbdc716ec8523db9afaed"
    },
    "merge_commit": "d4c013ce98fd78ef4efcbdc716ec8523db9afaed",
    "evidence_commit": "0d987970d268a212b31683881d2391c0c015a577",
    "evidence_pages_run": 28265880104,
    "release_receipt": "iterations/2026-06-26-webgpt-mvp-loop-caption-002/release-receipt.json",
    "proof_commit": "26b82c4",
    "proof_path": "delivery-proof/monocle-man/latest/deployment-proof.json",
    "proof_status": "PASS",
    "page_url": "https://grahama1970.github.io/chatgpt-lab/"
  },
  "gates": [
    {
      "name": "release_receipt_deployed",
      "status": "PASS",
      "evidence": "iterations/2026-06-26-webgpt-mvp-loop-caption-002/release-receipt.json"
    },
    {
      "name": "pages_proof_pass",
      "status": "PASS",
      "evidence": "delivery-proof/monocle-man/latest/deployment-proof.json"
    },
    {
      "name": "blocking_network_errors_zero",
      "status": "PASS",
      "evidence": "delivery-proof/monocle-man/latest/deployment-proof.json#/assertions/blocking_network_errors_count"
    },
    {
      "name": "release_commit_matches_proof",
      "status": "PASS",
      "evidence": "iterations/2026-06-26-webgpt-mvp-loop-caption-002/release-receipt.json#/post_merge/deployment_proof/commit"
    },
    {
      "name": "release_identity_explicit",
      "status": "PASS",
      "evidence": "iterations/2026-06-26-webgpt-mvp-loop-caption-002/release-receipt.json"
    }
  ],
  "next_action": {
    "owner": "WebGPT",
    "type": "create_bounded_pr_task",
    "instructions": "Create the next implementation-ready GitHub PR or issue using .github/pull_request_template.md and a valid phatgpt-task:v1 block. Keep scope to one bounded code, proof, or controller improvement."
  },
  "required_inputs": [
    "objective",
    "allowed_paths",
    "validation_commands",
    "expected_evidence",
    "stop_condition"
  ],
  "stop_condition": "Next task is not actionable until WebGPT or a human creates a GitHub PR/issue with a valid phatgpt-task:v1 block and explicit proof requirements.",
  "updated_at": "2026-06-26T21:30:00Z"
}
